{
  "schemaVersion": 2,
  "study": "first-use-v2",
  "sessionId": "S-00000001",
  "sessionSequence": 1,
  "entryPath": "npx",
  "consent": { "observationAccepted": true, "dataBoundaryAccepted": true },
  "fixture": { "id": "first-use-clean-room-v1", "repositoryDataShared": false, "networkRequired": false },
  "environment": { "surface": "codex", "os": "macos", "nodeMajor": 22 },
  "installation": { "status": "completed", "seconds": 90 },
  "firstReport": { "status": "completed", "seconds": 240 },
  "firstBlockage": "none",
  "resultStateComprehension": "correct",
  "suspectedMeaning": "lead_requires_confirmation",
  "patchConfidence": "ready_with_review",
  "sideEffectComprehension": "correct",
  "retest": { "status": "completed", "seconds": 75 },
  "retestDistinctionComprehension": "correct",
  "sessionOutcome": "completed",
  "manualNotesPresent": false
}
